{"schema":"ori.benchmark.v1","generated_at":"@unix:1778982421","environment":{"os":"macos","arch":"aarch64","rustc_version":"unknown","cpu":null},"suites":[{"name":"cold_check_latency","metrics":[{"key":"check_small_ns","unit":"ns","samples":100,"mean":3971.23,"p50":2209.0,"p95":6417.0,"max":49666.0,"min":2000.0}]},{"name":"warm_check_latency","metrics":[{"key":"check_medium_ns","unit":"ns","samples":100,"mean":24107.63,"p50":20208.0,"p95":46542.0,"max":77084.0,"min":19500.0}]},{"name":"cst_parse_latency","metrics":[{"key":"cst_medium_ns","unit":"ns","samples":100,"mean":28158.79,"p50":26000.0,"p95":37125.0,"max":96584.0,"min":25416.0}]},{"name":"agent_map_token_density","metrics":[{"key":"agent_map_medium_ns","unit":"ns","samples":100,"mean":29122.09,"p50":19708.0,"p95":75125.0,"max":107500.0,"min":19000.0}]},{"name":"patch_validation_latency","metrics":[{"key":"patch_check_ns","unit":"ns","samples":100,"mean":1649.99,"p50":1459.0,"p95":1625.0,"max":18209.0,"min":625.0}]},{"name":"patch_apply_latency","metrics":[{"key":"patch_apply_dry_ns","unit":"ns","samples":100,"mean":11232.1,"p50":9750.0,"p95":21292.0,"max":55542.0,"min":9458.0}]},{"name":"formatter_throughput","metrics":[{"key":"format_medium_ns","unit":"ns","samples":100,"mean":1898.34,"p50":1250.0,"p95":1750.0,"max":55500.0,"min":1125.0}]},{"name":"capsule_generation_latency","metrics":[{"key":"capsule_medium_ns","unit":"ns","samples":100,"mean":31452.53,"p50":23833.0,"p95":95459.0,"max":134459.0,"min":23250.0}]}]}
